>>CREATE TABLE LLREG028_UPSERT
+>  (id INT PRIMARY KEY,
+>   code VARCHAR(8),
+>   label VARCHAR(20),
+>   UNIQUE(code));
--- SQL operation complete.
>>INSERT INTO LLREG028_UPSERT VALUES (1, 'A', 'original');
--- 1 row(s) inserted.
>>UPSERT INTO LLREG028_UPSERT VALUES (1, 'A', 'updated');
--- 1 row(s) inserted.
>>UPSERT INTO LLREG028_UPSERT VALUES (2, 'B', 'inserted');
--- 1 row(s) inserted.
>>UPSERT INTO LLREG028_UPSERT VALUES
+>  (1, 'A', 'multi-update'),
+>  (3, 'C', 'multi-insert');
--- 2 row(s) inserted.
>>SELECT id, code, label
+>  FROM LLREG028_UPSERT
+> ORDER BY id;
ID           CODE      LABEL
-----------  --------  --------------------
          1  A         multi-update
          2  B         inserted
          3  C         multi-insert
--- 3 row(s) selected.
>>BEGIN WORK;
--- SQL operation complete.
>>UPSERT INTO LLREG028_UPSERT VALUES (1, 'Z', 'txn-update');
--- 1 row(s) inserted.
>>UPSERT INTO LLREG028_UPSERT VALUES (4, 'D', 'txn-insert');
--- 1 row(s) inserted.
>>SELECT id, code, label
+>  FROM LLREG028_UPSERT
+> ORDER BY id;
ID           CODE      LABEL
-----------  --------  --------------------
          1  Z         txn-update
          2  B         inserted
          3  C         multi-insert
          4  D         txn-insert
--- 4 row(s) selected.
>>ROLLBACK WORK;
--- SQL operation complete.
>>SELECT id, code, label
+>  FROM LLREG028_UPSERT
+> ORDER BY id;
ID           CODE      LABEL
-----------  --------  --------------------
          1  A         multi-update
          2  B         inserted
          3  C         multi-insert
--- 3 row(s) selected.
>>BEGIN WORK;
--- SQL operation complete.
>>DELETE FROM LLREG028_UPSERT WHERE id = 1;
--- 1 row(s) deleted.
>>UPSERT INTO LLREG028_UPSERT VALUES (1, 'A', 'replacement');
--- 1 row(s) inserted.
>>UPSERT INTO LLREG028_UPSERT VALUES (5, 'E', 'first-value');
--- 1 row(s) inserted.
>>UPSERT INTO LLREG028_UPSERT VALUES (5, 'E', 'second-value');
--- 1 row(s) inserted.
>>COMMIT WORK;
--- SQL operation complete.
>>SELECT id, code, label
+>  FROM LLREG028_UPSERT
+> ORDER BY id;
ID           CODE      LABEL
-----------  --------  --------------------
          1  A         replacement
          2  B         inserted
          3  C         multi-insert
          5  E         second-value
--- 4 row(s) selected.
>>BEGIN WORK;
--- SQL operation complete.
>>UPSERT INTO LLREG028_UPSERT VALUES (1, 'R', 'unique-changed');
--- 1 row(s) inserted.
>>UPSERT INTO LLREG028_UPSERT VALUES (6, 'A', 'unique-reused');
--- 1 row(s) inserted.
>>COMMIT WORK;
--- SQL operation complete.
>>SELECT id, code, label
+>  FROM LLREG028_UPSERT
+> ORDER BY id;
ID           CODE      LABEL
-----------  --------  --------------------
          1  R         unique-changed
          2  B         inserted
          3  C         multi-insert
          5  E         second-value
          6  A         unique-reused
--- 5 row(s) selected.
>>UPSERT INTO LLREG028_UPSERT VALUES
+>  (1, 'X', 'must-roll-back'),
+>  (8, 'B', 'duplicate-unique');
*** ERROR[8001]
*** ERROR[16001] No message found for SQLCODE -8001. duplicate local-lite unique key <MXID>
--- 0 row(s) inserted.
>>SELECT id, code, label
+>  FROM LLREG028_UPSERT
+> WHERE id IN (1, 8)
+> ORDER BY id;
ID           CODE      LABEL
-----------  --------  --------------------
          1  R         unique-changed
--- 1 row(s) selected.
>>CREATE TABLE LLREG028_SOURCE
+>  (id INT PRIMARY KEY,
+>   code VARCHAR(8),
+>   label VARCHAR(20));
--- SQL operation complete.
>>INSERT INTO LLREG028_SOURCE VALUES
+>  (2, 'B', 'select-update'),
+>  (7, 'G', 'select-insert');
--- 2 row(s) inserted.
>>UPSERT INTO LLREG028_UPSERT
+>  SELECT id, code, label FROM LLREG028_SOURCE;
--- 2 row(s) inserted.
>>SELECT id, code, label
+>  FROM LLREG028_UPSERT
+> WHERE id IN (2, 7)
+> ORDER BY id;
ID           CODE      LABEL
-----------  --------  --------------------
          2  B         select-update
          7  G         select-insert
--- 2 row(s) selected.
>>DROP TABLE LLREG028_SOURCE;
--- SQL operation complete.
>>DROP TABLE LLREG028_UPSERT;
--- SQL operation complete.
>>exit;
