>>CREATE TABLE LLREG033_UNIQUE_NULL
+>  (id INT NOT NULL PRIMARY KEY, code VARCHAR(8), label VARCHAR(20));
--- SQL operation complete.
>>INSERT INTO LLREG033_UNIQUE_NULL VALUES
+>  (1, NULL, 'null-one'),
+>  (2, NULL, 'null-two'),
+>  (3, 'X', 'non-null');
--- 3 row(s) inserted.
>>CREATE UNIQUE INDEX LLREG033_UN_IX ON LLREG033_UNIQUE_NULL(code);
--- SQL operation complete.
>>SELECT id, label FROM LLREG033_UNIQUE_NULL WHERE code IS NULL ORDER BY id;
ID           LABEL
-----------  --------------------
          1  null-one
          2  null-two
--- 2 row(s) selected.
>>INSERT INTO LLREG033_UNIQUE_NULL VALUES (4, NULL, 'null-three');
--- 1 row(s) inserted.
>>UPDATE LLREG033_UNIQUE_NULL SET code = NULL WHERE id = 3;
--- 1 row(s) updated.
>>SELECT id, label FROM LLREG033_UNIQUE_NULL WHERE code IS NULL ORDER BY id;
ID           LABEL
-----------  --------------------
          1  null-one
          2  null-two
          3  non-null
          4  null-three
--- 4 row(s) selected.
>>UPDATE LLREG033_UNIQUE_NULL SET code = 'X' WHERE id = 1;
--- 1 row(s) updated.
>>SELECT id, code FROM LLREG033_UNIQUE_NULL ORDER BY id;
ID           CODE
-----------  --------
          1  X
          2  ?
          3  ?
          4  ?
--- 4 row(s) selected.
>>DROP TABLE LLREG033_UNIQUE_NULL;
--- SQL operation complete.
>>CREATE TABLE LLREG033_COMPOSITE_NULL
+>  (id INT NOT NULL PRIMARY KEY, grp VARCHAR(4), score INT, label VARCHAR(20));
--- SQL operation complete.
>>INSERT INTO LLREG033_COMPOSITE_NULL VALUES
+>  (1, 'A', NULL, 'a-null'),
+>  (2, 'A', 10, 'a-ten'),
+>  (3, 'B', NULL, 'b-null'),
+>  (4, NULL, NULL, 'all-null');
--- 4 row(s) inserted.
>>CREATE INDEX LLREG033_GS_IX ON LLREG033_COMPOSITE_NULL(grp, score DESC);
--- SQL operation complete.
>>SELECT id, label FROM LLREG033_COMPOSITE_NULL
+> WHERE grp = 'A' AND score IS NULL ORDER BY id;
ID           LABEL
-----------  --------------------
          1  a-null
--- 1 row(s) selected.
>>SELECT id, label FROM LLREG033_COMPOSITE_NULL
+> WHERE grp IS NULL ORDER BY id;
ID           LABEL
-----------  --------------------
          4  all-null
--- 1 row(s) selected.
>>BEGIN WORK;
--- SQL operation complete.
>>UPDATE LLREG033_COMPOSITE_NULL SET score = NULL WHERE id = 2;
--- 1 row(s) updated.
>>SELECT id, label FROM LLREG033_COMPOSITE_NULL
+> WHERE grp = 'A' AND score IS NULL ORDER BY id;
ID           LABEL
-----------  --------------------
          1  a-null
          2  a-ten
--- 2 row(s) selected.
>>ROLLBACK WORK;
--- SQL operation complete.
>>SELECT id, label FROM LLREG033_COMPOSITE_NULL
+> WHERE grp = 'A' AND score IS NULL ORDER BY id;
ID           LABEL
-----------  --------------------
          1  a-null
--- 1 row(s) selected.
>>DROP INDEX LLREG033_GS_IX;
--- SQL operation complete.
>>DROP TABLE LLREG033_COMPOSITE_NULL;
--- SQL operation complete.
>>exit;
