>>CONTROL QUERY DEFAULT TRAF_BINARY_SUPPORT 'ON';
--- SQL operation complete.
>>CREATE TABLE LLREG039_T
+>  (id INT NOT NULL PRIMARY KEY,
+>   u8 VARCHAR(20) CHARACTER SET UTF8,
+>   u2 VARCHAR(10) CHARACTER SET UCS2,
+>   b BOOLEAN,
+>   bin BINARY(4),
+>   vb VARBINARY(4),
+>   lv LONG VARCHAR,
+>   iv INTERVAL DAY(3) TO SECOND(6));
--- SQL operation complete.
>>CREATE INDEX LLREG039_IX ON LLREG039_T (b, bin);
--- SQL operation complete.
>>SHOWDDL LLREG039_T;
CREATE TABLE "TRAFODION"."SEABASE"."LLREG039_T"
(
  "ID" INT NOT NULL,
  "U8" VARCHAR(20 CHARS) CHARACTER SET UTF8 COLLATE DEFAULT,
  "U2" VARCHAR(10) CHARACTER SET UCS2 COLLATE DEFAULT,
  "B" BOOLEAN,
  "BIN" BINARY(4),
  "VB" VARBINARY(4),
  "LV" LONG VARCHAR(2000) CHARACTER SET ISO88591 COLLATE DEFAULT,
  "IV" INTERVAL DAY(3) TO SECOND(6)
  PRIMARY KEY ("ID")
)
CREATE INDEX "LLREG039_IX" ON "TRAFODION"."SEABASE"."LLREG039_T" ("B", "BIN")
;
>>INSERT INTO LLREG039_T VALUES
+>  (1, '你好', _UCS2'世界', TRUE, X'0102', X'0304', 'long text', INTERVAL '1 02:03:04.000005' DAY TO SECOND);
--- 1 row(s) inserted.
>>SELECT id, u8, u2, b, bin, vb, lv, iv FROM LLREG039_T;
ID           U8                                                                                U2                    B      BIN       VB        LV                                                                                                                                                                                                                                                                                                                                                                                                                                                                                                                                                                                                                                                                                                                                                                                                                                                                                                                                                                                                                                                                                                                                                                                                                                                                                                                                                                                                                                                                                                                                                                                                                                                                                                                                                                                                                                                                                                                                                                                                                                                                                IV
-----------  --------------------------------------------------------------------------------  --------------------  -----  --------  --------  --------------------------------------------------------------------------------------------------------------------------------------------------------------------------------------------------------------------------------------------------------------------------------------------------------------------------------------------------------------------------------------------------------------------------------------------------------------------------------------------------------------------------------------------------------------------------------------------------------------------------------------------------------------------------------------------------------------------------------------------------------------------------------------------------------------------------------------------------------------------------------------------------------------------------------------------------------------------------------------------------------------------------------------------------------------------------------------------------------------------------------------------------------------------------------------------------------------------------------------------------------------------------------------------------------------------------------------------------------------------------------------------------------------------------------------------------------------------------------------------------------------------------------------------------------------------------------------------------------------------------------------------------------------------------------------------------------------------------------------------------------------------------------------------------------------------------------------------------------------------------------------------------------------------------------------------------------------------------------------------------------------------------------------------------------------------------------  --------------------
          1  你好                                                                            世界                TRUE   01020000  0304      long text                                                                                                                                                                                                                                                                                                                                                                                                                                                                                                                                                                                                                                                                                                                                                                                                                                                                                                                                                                                                                                                                                                                                                                                                                                                                                                                                                                                                                                                                                                                                                                                                                                                                                                                                                                                                                                                                                                                                                                                                                                                                            1 02:03:04.000005
--- 1 row(s) selected.
>>SELECT id FROM LLREG039_T WHERE b = TRUE;
ID
-----------
          1
--- 1 row(s) selected.
>>SELECT id FROM LLREG039_T WHERE bin = CAST(X'01020000' AS BINARY(4));
ID
-----------
          1
--- 1 row(s) selected.
>>UPDATE LLREG039_T SET b = FALSE, u8 = '再见' WHERE id = 1;
--- 1 row(s) updated.
>>SELECT id, b, u8 FROM LLREG039_T;
ID           B      U8
-----------  -----  --------------------------------------------------------------------------------
          1  FALSE  再见
--- 1 row(s) selected.
>>DROP INDEX LLREG039_IX;
--- SQL operation complete.
>>DROP TABLE LLREG039_T;
--- SQL operation complete.
>>exit;
